{
  "schema_version": 1,
  "dataset": "challenge",
  "generated_at": "2026-10-01T00:29:13Z",
  "data_as_of": null,
  "source": "CME challenge results via www.cmegroup.com (UNVERIFIED source and parser)",
  "status": "error",
  "errors": [
    "source not configured (challenge url/account is null in jobs/config/sources.json)"
  ],
  "data": null
}
